{"version":1,"starterTemplate":"marketer","identity":{"targetRoles":["Director of Performance Marketing","Senior Marketing Manager"],"targetSeniority":"director","yearsRelevantExperience":8,"primaryNarrative":"Pat Probe is a data engineer at Probe Corp who builds warehouse pipelines and streaming ingestion."},"strengths":[{"name":"Performance marketing","rank":1,"evidence":"Built and ran paid acquisition (Google, Meta, programmatic) at $5M+ annual spend with CAC payback under 12 months.","keywords":["paid acquisition","CAC","ROAS","attribution"]},{"name":"Brand & content","rank":2,"evidence":"Owned editorial calendar and brand voice across web, social, and email; led two refreshes from positioning to launch.","keywords":["brand","content strategy","positioning"]},{"name":"Analytics & experimentation","rank":3,"evidence":"Built marketing analytics stack (GA4 + warehouse) and ran a continuous experimentation program with weekly tests.","keywords":["analytics","A/B testing","MMM","attribution"]},{"name":"Channel management","rank":4,"evidence":"Managed an in-house + agency channel team of 6, coordinating launches across paid, organic, lifecycle, and partnerships.","keywords":["channel mix","agency management","lifecycle"]}],"wants":["P&L responsibility","Mix of brand and performance","Direct reports","Cross-functional partnership with product"],"avoids":["Pure community management","Agency-side account management","Heavy events / field marketing"],"hardConstraints":{"workMode":"any","acceptableLocations":[],"workAuth":"any","skipTitles":["intern","associate","coordinator"],"salaryRequired":false}}